columns_raw,columns_cleaned,data_type,nullable,fill_method,fill_value,use_for_training,hold_out_columns,description,comments from Shane,Matt Comments
exec_summary_short_term_cash_forecast_m1,exec_summary_short_term_cash_forecast_m1,NUMBER,Y,constant,NULL,Y,N,Previous month short term cash forecast (needed),,
exec_summary_current_assets_to_liabilities_m1,exec_summary_current_assets_to_liabilities_m1,NUMBER,Y,constant,NULL,Y,N,Previous month current ratio %,,
exec_summary_term_assets_to_liabilities_m1,exec_summary_term_assets_to_liabilities_m1,NUMBER,Y,constant,NULL,Y,N,Previous month NCA : NCL ratio %,,
fundtap_loan_principal,fundtap_loan_principal,NUMBER,N,not_applicable,,Y,N,The principal to be funded on this specific quote,,
Line of Business,line_of_business,VARCHAR,Y,constant,Unknown,Y,N,,,For these 3 we should not have Unknown's - need to enter the data.
Customer Type,customer_type,VARCHAR,Y,constant,Unknown,Y,N,Industry,,
Accounting Software,accounting_software,VARCHAR,Y,constant,Unknown,Y,N,What accounting software are they using,,
Customer_UID,customer_uid,VARCHAR,N,not_applicable,,Y,N,Customer ID number,,"Strong feature signal, but arbitary number - does indicate age of FundTap customer."
Commercial_Credit_Report_Creation_Date,commercial_credit_report_creation_date,DATETIME,Y,not_applicable,,N,N,When did we get the commercial credit report,,I assume we don't include these in the training data?
Consumer_Credit_Report_First_Creation_Date,consumer_credit_report_first_creation_date,DATETIME,Y,not_applicable,,N,N,When did we get the consumer credit report for guarantor 1,,
Consumer_Credit_Report_Second_Creation_Date,consumer_credit_report_second_creation_date,DATETIME,Y,not_applicable,,N,N,When did we get the consumer credit report for guarantor 2,,
Consumer_Credit_Report_Third_Creation_Date,consumer_credit_report_third_creation_date,DATETIME,Y,not_applicable,,N,N,When did we get the consumer credit report for guarantor 3,,
Bank_Statement_Creation_Date,bank_statement_creation_date,DATETIME,Y,not_applicable,,N,N,The date we pulled bank reports for the client,,
Xero_Report_Creation_Date,xero_report_creation_date,DATETIME,Y,not_applicable,,N,N,The date we puled reports from the accounting system,,
fundtap_profit_loss,fundtap_profit_loss,NUMBER,Y,not_applicable,,Y,Y,"OUTCOME ARE TRAINING THE MODEL FOR: GOOD = PROFITABLE, BAD = NOT PROFITABLE",,Current model uses a pentalty of $20/week overdue.  Drives algorithm to favour large invoices as takes longer overdue to not be profitable.  Tried new one where 1/12 of the fee is removed each week overdue - issues with many existing client funding failing with too low Probability of Profitability scores.
fundtap_status,fundtap_status,VARCHAR,Y,not_applicable,,Y,N,What status is this invoice in,,
Country,country,VARCHAR,Y,constant,unknown,Y,N,What country is the customer from,,
Fundtap_Fee,fundtap_fee,NUMBER,Y,not_applicable,,Y,N,What is the fee we'd earn on this,,
Weeks past due,weeks_past_due,NUMBER,Y,not_applicable,,Y,N,How many weeks this has been past due,,"Only appears post invoice status changed to ""Completed"". NB. Status ""Due"" is Auto set when invoice following the original Invoice Due date, not the Repay Date. "
Weeks overdue,weeks_overdue,NUMBER,Y,not_applicable,,Y,N,How many weeks this has been marked as overdue,,
Weeks In Default,weeks_in_default,NUMBER,Y,not_applicable,,Y,N,How many weeks this has been marked as in default,,
prior_fundtap_history_pending_sum,prior_fundtap_history_pending_sum,NUMBER,Y,constant,0,Y,N,Total FundTap lending currently outstanding,,
Total Bank,total_bank,NUMBER,Y,constant,NULL,Y,N,Total bank balance per accounting system,,
Accounts Receivable,accounts_receivable,NUMBER,Y,constant,NULL,Y,N,Total AR balance per accounting system,"SL. Are specific figures being compared to their counterpart, as often the numbers themselves are abitrary and dependant on the business. Ie. AR vs AP. CA vs CL. FA vs TL etc etc",
GST,gst,NUMBER,Y,constant,NULL,Y,N,Total GST balance per accounting system,SL. Should this be run on 'expected GST' as per sales checklist? Again the number is arbitrary if not compared to revenue,
Total Current Assets,total_current_assets,NUMBER,Y,constant,NULL,Y,N,Total Curent Assets balance per accounting system,,
Total Fixed Assets,total_fixed_assets,NUMBER,Y,constant,NULL,Y,N,Total Fixed Assets balance per accounting system,,
Total Non-Current Assets,total_non_current_assets,NUMBER,Y,constant,NULL,Y,N,Total NC Assets balance per accounting system,,
Total Assets,total_assets,NUMBER,Y,constant,NULL,Y,N,Total Assets balance per accounting system,,
Accounts Payable,accounts_payable,NUMBER,Y,constant,NULL,Y,N,Total AP balance per accounting system,,
Total Current Liabilities,total_current_liabilities,NUMBER,Y,constant,NULL,Y,N,Total current liabilities balance per accounting system,,
Total Non-Current Liabilities,total_non_current_liabilities,NUMBER,Y,constant,NULL,Y,N,Total non-current liabilities balance per accounting system,,
Total Liabilities,total_liabilities,NUMBER,Y,constant,NULL,Y,N,Total liabilities balance per accounting system,,
Net Assets,net_assets,NUMBER,Y,constant,NULL,Y,N,Net assets per accounting system,,
Current Year Earnings,current_year_earnings,NUMBER,Y,constant,NULL,Y,N,Current year earnings per accounting system,,
Retained Earnings,retained_earnings,NUMBER,Y,constant,NULL,Y,N,Retained earnings per accounting system,,
Total Equity,total_equity,NUMBER,Y,constant,NULL,Y,N,Total equity balance per accounting system,,
,,,,,,,,,,
,,,,,,,,,SL. Do additional Trust/Corp guarantees need to be factored in as effectively would be lowering default risk? Should we be measuring their credit score/GSA as per additional guarantors?,
